name,milk,crust,origin,senses,pairings,similarities
Rovethym,Chèvre,Molle à croûte fleurie,Provenance : BelgiqueLabel : Appellation d'Origine Protégée AOP% Matière Grasse/Poids Total : 28 %Lait : Lait pasteurisé de Vache,"['Oeil : Croûte orangée', 'Nez : légère senteur de bière', 'Gout : saveur dine et douce', 'Toucher : onctueux']","[<p>Il s’accompagne de bières blanches ou d’un vin blanc, tel qu’un Chablis.</p>]","['Saint-Félicien fermier', 'Pont l’Evêque AOP entier', 'Reblochon Fermier AOP entier', 'Neufchâtel AOP']"
Sablé de Wissant,Vache,Molle à croûte lavée,Provenance : Auvergne_Rhône-AlpesLait : Lait cru de vache% Matière Grasse/Poids Total : 27 %,"['Oeil: Croûte naturelle couleur ivoire sur laquelle peut se former un duvet bleuté', 'Nez : odeur de champignons', 'Goût : double crème onctueux. Goût d’étable, doux, frais et lacté. Persistant en bouche.', 'Toucher : Moelleux et crémeux']","[<p>Crémeux en bouche, le Saint Félicien se déguste à la petite cuillère. Grâce à sa douce saveur, il est idéal pour se faire la bouche avant de gouter à l’ensemble des fromages du plateau.</p>, <p>Le Saint Félicien réalise un très beau mariage avec les vins de sa région. Il peut s’accompagner d’un vin blanc sec tel qu’un Côtes du Rhône ou un Condrieu. Il peut aussi s’accorder avec du vin rouge comme un Crozes-Hermitage, un Beaujolais ou encore un bon Vacqueyras.</p>]","['Saint Marcellin fermier IGP', 'Crottin de Chavignol AOP', 'Chabichou du Poitou AOP']"
Saint-Félicien,Vache,Molle à croûte fleurie,Provenance : Ile de FranceProducteur : Ferme de la TremblayeLait : Lait pasteurisé de Vache% Matière Grasse/Poids Total : 27 %,"['Oeil : croûte fleurie blanche', 'Nez : Teinté de saveurs florales', 'Goût : Délicatement salée avec des arômes de lait et un discret goût de champignon', 'Toucher : Texture très crémeuse et souple']",[<p>Le Saint-Jacques Fermier se déguste avec un verre de vin rouge tel qu’un Bourgueil.</p>],"['Neufchâtel AOP', 'Saint Marcellin fermier IGP', 'Bethmale', 'Brie de Meaux fermier AOP']"
Saint-Jacques,Vache,Molle à croûte fleurie,Provenance : Auvergne_Rhône-AlpesLait : Lait cru de vache% Matière Grasse/Poids Total : 23 %,"['Oeil : Croûte naturelle couleur ivoire, peut se couvrir de Bleu de la moisissure', 'Nez : odeur de champignons', 'Gout : goût de crème battue mélangée de noisette', 'Toucher : Moelleux et crémeux jeune, et devient ferme en s’affinant']","[<p>Ce fromage peut tout aussi bien se déguster avec du vin blanc qu’avec du vin rouge.</p>, <p>Les vins blancs qui accompagnent le Saint-Marcellin à la perfection sont :</p>, <p>Pour ceux qui affectionnent particulièrement le vin rouge, vous avez le choix entre les :</p>]","['Crottin de Chavignol AOP', 'Chabichou du Poitou AOP', 'Saint-Félicien fermier', 'Bouton de Culotte fermier']"
Saint-Marcellin,Vache,Molle à croûte naturelle,Provenance : Auvergne_Rhône-Alpes% Matière Grasse/Poids Total : 35 %Lait : Lait pasteurisé de VacheProducteur : Buttay Frères,"['Œil : couleur ivoire à jaune pâle', 'Nez : Doux', 'Goût : fruité et légèrement salé aux arômes généreux', 'Toucher : texture souple et fondante']","[<p>Le Saint Mont Crémier du Jura se déguste avec un vin rouge, tel qu’un Bourgogne, pinot noir ou côtes d’Auxerre.</p>]","['Munster fermier AOP 1/2', 'Gruyère Suisse d’Alpage AOP 12 Mois', 'Brillat-Savarin IGP', 'Camembert de Normandie AOP']"
Saint Mont Crémier du Jura,Vache,Pressée cuite,"Provenance : Auvergne_Rhône-AlpesLait : Lait cru de vache% Matière Grasse/Poids Total : 22,50 %Particularité : Fermier - Affiné dans les caves fromagères d'Auvergne","['Oeil :  Croûte fine ouverte de fleurs blanches, jaunes ou rouges ; pâte fine', 'Nez :  Légère odeur de champignon', 'Gout : Saveur de noisette caractéristique', 'Toucher : Pâte souple et onctueuse qui fléchit sous le doigt']",[<p>Ce fromage d’Auvergne se déguste idéalement avec du vin rouge sec :</p>],"['Cheddar Extra-Mature', 'Reblochon Fermier AOP entier', 'Salers AOP', 'Tête de Moine entière']"
Saint-Nectaire,Vache,Pressée non cuite,"Provenance : Auvergne_Rhône-AlpesLait : Lait cru de vache% Matière Grasse/Poids Total : 22,50 %Particularité : Fermier - Affiné dans les caves fromagères d'Auvergne","['Oeil :  Croûte fine ouverte de fleurs blanches, jaunes ou rouges ; pâte fine', 'Nez :  Légère odeur de champignon', 'Gout : Saveur de noisette caractéristique', 'Toucher : Pâte souple et onctueuse qui fléchit sous le doigt']",[<p>Ce fromage d’Auvergne se déguste idéalement avec du vin rouge sec :</p>],"['Cheddar Extra-Mature', 'Reblochon Fermier AOP entier', 'Salers AOP', 'Tête de Moine entière']"
Saint-Paulin,Vache,Pressée non cuite,Provenance : Centre-Val de LoireLait : Lait cru de chèvre% Matière Grasse/Poids Total : 25 %,"['Oeil : Croûte bien fine et régulière avec moisissures superficielles gris−bleutées.', 'Nez : Odeur légèrement caprine', 'Gout : Saveur douce et au goût de noisette selon les saisons', 'Toucher : Pâte ferme et homogène']","[<p style=""text-align: justify;"">Le Sainte-Maure de Touraine se déguste avant ou en fin de repas, et mieux encore en apéritif. Comme pour tous les fromages de chèvre, le vin devra opposer l’acidité affutée du fromage surtout si celui-ci est bien affiné. Entre son acidité et sa texture crémeuse, le Sainte-Maure de Touraine s’accompagne de vins blancs vifs comme un Touraine-Sauvignon. Pour les amateurs de rouge, un vin léger et fruité comme un Gamay, un Bourgueil, un Chinon ou un Cabernet d’Anjou, sera parfait.</p>]","['Saint-Félicien fermier', 'Rocamadour AOP Fermier', 'Valençay AOP fermier', 'Saint Marcellin fermier IGP']"
Sainte-Maure de Touraine,Chèvre,Molle à croûte naturelle,Provenance : Auvergne_Rhône-AlpesLabel : Appellation d'Origine Protégée AOPLait : Lait cru de vache% Matière Grasse/Poids Total : 44 %,"['Œil : Croûte dorée, tendant vers le brun', 'Nez : Jeune, notes de beurre et de crème', 'Goût : délicats arômes fleuris voir épicés', 'Toucher : Texture ferme et fondante']","[<p>Les vins légers à l’instar des vins blancs secs viendront ajouter une note de douceur à la saveur corsée du Salers. Vous pourrez ainsi déguster ce fromage avec du :</p>, <p>Si vous avez un Salers jeune, vous pouvez opter pour du vin rouge :</p>]","['Tête de Moine entière', 'Tomme de Tarentaise fermière', 'Gouda au Cumin Fermier', 'Gouda Fermier Vieux 12-18 Mois']"
Salers,Vache,Pressée non cuite,Provenance : Bourgogne - Franche-ComtéProducteur : Fromagerie Chevenet% Matière Grasse/Poids Total : 12 %Lait : Lait cru de chèvre,"['Oeil : Crémeux', 'Nez : Odeur caprine agrémentée, de foin et de rose. ', 'Goût : rafraichissant et un peu acidulé, goût de noix fraîches. Les pétales de rose qui l’englobent, apportent de la texture et une légère amertume. ', 'Toucher : Pâte ferme et tendre à la fois ']",[<p>Le Satonnay Pétales de roses s’accompagne d’un Vin blanc sec tel qu’un Mâcon-Vinzelles.</p>],"['Vacherin – Mont d’Or AOP (Boite d’environ 500g)', 'Sainte-Maure de Touraine AOP', 'Valençay AOP fermier', 'Calisson cendré de chèvre']"
Satonnay Pétales Roses,Chèvre,Pâte molle à croûte naturelle,Provenance : Centre-Val de LoireProducteur : Annie Askamp - Le Brebis du Berry% Matière Grasse/Poids Total : MGNPLait : Lait cru de brebis,"['Oeil : Croûte blanche, coupe lisse', 'Nez : Noisette', 'Gout : Doux, saveur acidulée et prononcée', 'Toucher : Structure crailleuse']","[<p>Le Saulzais s’accompagne très bien d’un Vin sec, Côtes de Duras.</p>]","['Calisson cendré de chèvre', 'Chabichou du Poitou AOP', 'Mothais sur feuille fermier', 'Sainte-Maure de Touraine AOP']"
Saulzais,Brebis,Pâte molle à croûte naturelle,Provenance : Nouvelle AquitaineProducteur : Johnny BlancParticularité : Affiné sur feuille de chataignier% Matière Grasse/Poids Total : 20 %Lait : Lait cru de chèvre,"['Oeil : croûte naturellement légèrement crémeuse', 'Nez : Odeur de sous-bois.', 'Goût : Saveur noiseté.', 'Toucher : Texture fondante et crémeuse.']","[<p style=""text-align: justify;"">Le Sauvaget se déguste avec un vin blanc, tel qu’un Jurançon blanc sec.</p>]","['Selles-sur-cher AOP fermier', 'Bleu de Chèvre', 'Pouligny-Saint-Pierre AOP fermier', 'Calisson cendré de chèvre']"
Sauvaget,Chèvre,Pâte molle à croûte naturelle,Provenance : Auvergne_Rhône-AlpesLait : Lait cru de vacheProducteur : Gaec Essarts,"['Œil : Croûte brune', 'Nez : Odeur prononcée ', 'Goût : goût affirmé', 'Toucher : Pâte dur et cassante']","[<p>Si vous avez l’habitude de déguster le Séchon au bout d’un pique à l’apéritif, sachez qu’il est exquis accompagné d’une bière noire. Il est aussi en parfait accord avec du vin rouge puissant.</p>]","['Saint-Félicien fermier', 'Crottin de Chavignol AOP', 'Bouton de Culotte fermier', 'Saint Marcellin fermier IGP']"
Séchon de Vache,Vache,Pâte molle à croûte naturelle,Provenance : Centre-Val de LoireLabel : Appellation d'Origine Protégée AOP% Matière Grasse/Poids Total : 29 %Lait : Lait cru de chèvreParticularité : Fermier,"['Oeil : Forme bien nette, croûte bleu foncé, pâte d’un blanc pur', 'Nez : Odeur légèrement caprine', 'Gout : Saveur douce et noisetée, pâte fondante', 'Toucher : Pâte ferme et très fine']","[<p style=""text-align: justify;"">Le Selles−sur−Cher est avant tout un fromage de fin de repas qui s’accompagne de vins de son terroir : un vin blanc sec, Touraine blanc, ou un rouge léger et fruité, Chinon, Bourgueil.</p>, <p style=""text-align: justify;"">Présenté en tranches fines, il peut aussi être servi à l’apéritif.</p>, <p style=""text-align: justify;"">Il ne faut surtout pas gratter la croûte : c’est elle qui donne au fromage son caractère particulier. Très décoratif, il apporte une note fraîche dans un buffet de fromages.</p>]","['Sainte-Maure de Touraine AOP', 'Pouligny-Saint-Pierre AOP fermier', 'Bouton de Culotte fermier', 'Crottin de Chavignol AOP']"
Selles-sur-Cher,Chèvre,Molle à croûte fleurie,Provenance : Royaume-Uni% Matière Grasse/Poids Total : 35 %Lait : Lait pasteurisé de Vache,"['Œil : Pâte blanche couleur crème, avec de la “moisissure” de manière uniforme dans tout le fromage.', 'Nez : Odeur puissante.', 'Goût : une forte saveur. Arôme légèrement piquant avec une petite acidité.', 'Toucher : Légèrement crémeux.']",[<p>Le Shropshire blue se déguste avec un vin blanc liquoreux tel que le Sauternes ou le Montbazillac.</p>],"['Reblochon Fermier AOP entier', 'Beaufort chalet alpage AOP', 'Blue Stilton AOP', 'Bethmale']"
Shropshire blue,Vache,Persillée,Provenance : Pays de la Loire% Matière Grasse/Poids Total : 26 %Lait : Lait pasteurisé de Vache,"[nan, nan, nan, nan]",,"['Mimolette', 'Saint Marcellin fermier IGP', 'Cheddar Extra-Mature', 'Gouda au Cumin Fermier']"
Sillon bleu de Vache,Vache,Persillée,Provenance : Auvergne_Rhône-Alpes% Matière Grasse/Poids Total : 28 %Lait : Lait cru de vache,"['Oeil : Croûte grise, légèrement duveté', 'Nez : Notes alpines, de fruits secs et de noix', 'Gout :', 'Toucher : Texture riche et légèrement élastique']",[<p>Le Skieur s’accompagne d’un vin blanc de Savoie comme la Roussette.</p>],"['Gruyère Suisse d’Alpage AOP 12 Mois', 'Morbier AOP 100jours', 'Parmesan DOP', 'Etivaz AOP']"
Skieur,Vache,Pressée cuite,Lait : Lait cru de vacheLabel : Indication Géographique Protégée (IGP)Provenance : Bourgogne - Franche-ComtéProducteur : Ferme Leclere% Matière Grasse/Poids Total : 28 %,"['Oeil : Couleur orangé', 'Nez : Odeur forte', 'Gout : Goût assez prononcé, avec une légère amertume et doux en bouche.', 'Toucher :  Texture moelleuse et crémeuse']","[<p>Le soumaintrain est idéalement un fromage de plateau de fin de repas à accompagner avec un bon verre de vin de Côte de Beaune, de Chablis, de Beaujolais ou encore de Chardonnay.</p>]","['Morbier AOP 100jours', 'Camembert de Normandie AOP', 'Saint Marcellin fermier IGP', 'Raclette Fumée']"
Soumaintrain,Vache,Molle à croûte lavée,Provenance : OccitanieProducteur : Fromagerie du Fedou% Matière Grasse/Poids Total : 32 %Lait : Lait cru de brebisParticularité : Tommette,"['Oeil : Aspect cire coulé sur la croûte', 'Nez :  Cave Humide, Champignons', 'Gout : Fromage goûteux et long en bouche, caractérisé par les arômes du lait cru de brebis associés à une pâte souple et fondante en bouche.', 'Toucher : Sa croûte est très fleurie, de couleur grise avec quelques taches jaunes et blanches; sa pâte est très blanche, dense et homogène.']",[],"['Tomme de Brebis des Pyrénées', 'Buchette de Chèvre cendrée', 'Saint Marcellin fermier IGP', 'Mothais sur feuille fermier']"
Souréliette,Brebis,Pressée non cuite,Provenance : Royaume-UniLait : Lait pasteurisé de Vache% Matière Grasse/Poids Total : 28 %Label : Appellation d'Origine Protégée AOP,"['Oeil : Pâte blanche couleur crème, avec de la “moisissure” de manière uniforme dans tout le fromage.', 'Nez : Odeur pénétrante et agréable', 'Goût : Plus doux que le roquefort, il reste avec beaucoup de caractère. Saveur légèrement piquante, mais fondante en bouche.', 'Toucher : Texture friable et souple']","[<p>Le Stilton se consomme en fin des repas ou en cuisine. Il se déguste avec un porto, un sauternes ou un muscat.</p>]","['Fourme d’Ambert AOP', 'Munster fermier AOP 1/2', 'Bleu de Gex AOP', 'Bleu d’Auvergne Fermier AOP']"
Stilton bleu,Vache,Persillée,"Provenance : ItalieLabel : Appellation d'Origine Protégée AOP, Denominazione di Origine Protetta - DOP% Matière Grasse/Poids Total : 29 %Lait : Lait cru de vache","['Oeil : Croûte mince, rosé, avec 4 Lobes dessinés sur le dessus et une pâte ivoire, crémeuse', 'Nez :  Odeur franche après quelques jours d’affinages', 'Gout : Saveur douce à forte, selon l’affinage, légèrement acidulée avec un arrière-goût de truffe', 'Toucher : Pâte tendre']","[<p>Le Taleggio s’accompagne d’un chianti Classico, un Montbazillac, un Condrieu, un Vin Blanc sec du Languedoc ou un Rosé de Provence.</p>]","['Maroilles fermier AOP 1/2', 'Munster fermier AOP 1/2', 'Bergues au torchon fermier', 'Herve à la Bière']"
Taleggio,Vache,Molle à croûte lavée,Provenance : Nouvelle AquitaineProducteur : Monique VALENTI% Matière Grasse/Poids Total : 25 %Lait : Lait cru de chèvreParticularité : Fermier,"['Oeil : Dôme de couleur gris-bleutée. Croûte fine.', 'Nez : Odeur caprine.', 'Gout : Douceur en bouche. Arômes délicats de noisette et de sous-bois', 'Toucher : Pâte ferme et souple']","[<p style=""text-align: justify;"">La Taupinière se déguste accompagné de vins blancs tel qu’un Puilly fumé ou un Pineau.</p>]","['Bouton de Culotte fermier', 'Selles-sur-cher AOP fermier', 'Bleu de Chèvre', 'Crottin de Chavignol AOP']"
Taupinière,Chèvre,Pâte molle à croûte naturelle,Provenance : SuisseLait : Lait cru de vache% Matière Grasse/Poids Total : 33 %Label : Appellation d'Origine Protégée AOP,"['Oeil : croûte naturelle, de couleur brune. Pâte couleur ivoire à jaune clair', 'Nez : fruité', 'Goût : Parfumé', 'Toucher : ferme avec une croûte légèrement “collante”']","[<p>La Tête de Moine se marie parfaitement à un vin blanc puissant, tel qu’un vin du Jura, ou tel qu’une Altesse du Bugey (Savoie).</p>]","['Cantal AOP Entre-Deux fermier', 'Herve à la Bière', 'Pont l’Evêque AOP entier', 'St-Nectaire Fermier AOP']"
tête de Moine,Vache,Pressée non cuite,Provenance : Auvergne_Rhône-AlpesLait : Lait cru de vache% Matière Grasse/Poids Total : 25 %,"['Oeil : croûte tourmentée, grise, sur laquelle peuvent se développer des fleurs de couleur jaune, rouge, rose ou blanche. Pâte ivoire à jaune.', 'Nez : odeur de cave légère', 'Gout : arômes fruités et variés', 'Toucher : pâte souple et fondante']","[<p style=""text-align: justify;"">Traditionnellement, la Tome des Bauges se consomme avec une tranche de pain de campagne. Mais vous romprez la monotonie en égayant le tout de noisettes, de pruneaux, de pommes reinettes, de fenouil, de tomates, d’endives.</p>, <p style=""text-align: justify;"">Il s’accompagne très bien d’un verre de vin blanc sec léger d’Alsace, comme par exemple un Pinot Blanc du Domaine du moulin de Dusenbach, ou avec un vin rouge fruité, rond, tel qu’un Bordeaux, un Bregerac ou un Chinon.</p>]","['Tomme de Yenne', 'Cantal AOP Entre-Deux fermier', 'Tomme d’Auvergne Mitée', 'Tomme Ail des Ours']"
Tome des Bauges AOP,Vache,Pressée non cuite,Provenance : Bourgogne - Franche-ComtéLait : Lait cru de chèvre% Matière Grasse/Poids Total : 26 %Producteur : Ferme de Cruzille,"['Oeil : croûte grise et pâte entre blanche et jaune, selon la durée de son affinage', 'Nez : Arôme de champignons', 'Goût : goût de chèvre prononcé, délicatement fruité, avec une saveur de noisette', 'Toucher : Structure ferme et légèrement onctueux']","[<p>Ce chèvre s’accompagne parfaitement avec un vin blanc tel qu’un Pouilly-Fuissé, un Pouilly-Loché ou un Pouilly-Vinzelles.</p>]","['Crottin de Chavignol AOP', 'Tomme du Jura', 'Pouligny-Saint-Pierre AOP fermier', 'Bleu de Gex AOP']"
Tome du Cruzille,Chèvre,Pressée non cuite,Provenance : Occitanie% Matière Grasse/Poids Total : 30 %Lait : Lait cru de vache,"['Oeil :', 'Nez :', 'Gout :', 'Toucher :']","[<p>A accompagner d’un vin blanc tendre comme un Tarani, ou un Gaillac doux, tel que du Domaine Labarthe.</p>]","['St-Nectaire Fermier AOP', 'Gouda au Cumin Fermier', 'Tomme du Jura', 'Reblochon Fermier AOP entier']"
Tome du Ségala,Vache,Pressée non cuite,Provenance : Grand EstLait : Lait pasteurisé de Vache% Matière Grasse/Poids Total : 32 %,"['Oeil : croûte marron clair avec une pâte onctueuse jaune clair.', 'Nez : Odeur de pâturage', 'Goût : Légères notes de noisette sur un fond de houblon', 'Toucher : Texture souple  et croûte granuleuse']",[<p>La Tome le Saulnois aux cônes de houblon s’accompagne d’une bière du Nord ou d’un vin blanc doux du Sud-Ouest.</p>],"['Reblochon Fermier AOP entier', 'Tomme de Brebis des Pyrénées', 'Morbier AOP 100jours', 'Saint Marcellin fermier IGP']"
Tome le Saulnois aux cones de Houblon,Vache,Pressée non cuite,Provenance : Nouvelle AquitaineLait : Lait cru de brebis,"['Oeil : Croûte épaisse, allant du marron au gris.', 'Nez : Légère saveur de noisette.', 'Goût : puissance de la Brebis.', 'Toucher : La pâte est souple et la croûte très ferme.']",[<p>La tomette de Brebis Etchegoinia se sert avec un vin blanc type Pacherinc-de-Vic-Bilh sec.</p>],"['Tomme de Yenne', 'Tomme fermière au Foin', 'Tomme de Tarentaise fermière', 'Tomme de Brebis des Pyrénées']"
Tomette de brebis Etchegoinia,Brebis,Pressée non cuite,Provenance : Auvergne_Rhône-AlpesParticularité : Affiné dans les caves de SavoieLait : Lait cru de vache% Matière Grasse/Poids Total : 25 %,"['Oeil : Couleur pâte jaune avec une grande présence de la plante ail des ours hachée', 'Nez : aromatique et très odorante', 'Gout : Légèrement salé et épicé', 'Toucher : ferme et souple']","[<p>Associez cette tomme à un vin blanc sec, comme un côtes du Jura.</p>]","['Tome des Bauges AOP', 'Tomme de Yenne', 'Tomme de Tarentaise fermière', 'Tomme d’Auvergne Mitée']"
Tomme Ail des ours,Vache,Pâte pressée non cuite,Provenance : Auvergne_Rhône-AlpesProducteur : Le Farto de Thônes% Matière Grasse/Poids Total : 30 %Lait : Lait cru de vache,"['Oeil : Croûte grise duveté', 'Nez : Arômes légèrement anisés', 'Goût : Goût délicat', 'Toucher : Texture souple']","[<p>Accompagner votre Tomme au Chniu d’un vin blanc type Entre-Deux-Mers, ou un vin rouge, type Pinot Noir.</p>]","['Gouda Fermier Vieux 12-18 Mois', 'Cheddar Extra-Mature', 'Salers AOP', 'Tomme de Yenne']"
Tomme au chniu,Vache,Pressée non cuite,Provenance : Auvergne_Rhône-AlpesLait : Lait cru de vache% Matière Grasse/Poids Total : 29 %,"['Oeil : Croûte de couleur jaune-marron', 'Nez : Odeur de foin fraîchement coupé', 'Goût : Puissance de la pâte, lié à l’affinage', 'Toucher : Texture souple, avec une croûte légèrement humide']","[<p>La Tomme au foin doit se déguster avec un vin rouge, type Valençay.</p>]","['Camembert de Normandie AOP', 'Tome des Bauges AOP', 'Saint-Félicien fermier', 'Mimolette']"
Tomme au foin,Vache,Pressée non cuite,Provenance : Auvergne_Rhône-AlpesLait : Lait cru de vache% Matière Grasse/Poids Total : 32 %,"['Oeil : croûte marron, avec une pâte onctueuse jaune clair.', 'Nez : Odeur de terre', 'Goût : Goût de Houblon et persistant en bouche.', 'Toucher : Texture souple  et croûte légèrement granuleuse']","[<p>La Tomme brossée à la bière s’accompagne d’une bière Savoyarde bien-sûr, ou un vin rouge de Savoie tel qu’un Jongieux ou un Beaujolais Rouge.</p>]","['Saint Marcellin fermier IGP', 'Tomme de Tarentaise fermière', 'Cantal AOP Entre-Deux fermier', 'Mimolette']"
Tomme brossée à la bière,Vache,Pressée non cuite,Provenance : EspagneLait : Lait pasteurisé de Vache% Matière Grasse/Poids Total : 27 %,"['Oeil : Pâte souple, aérée', 'Nez : Arômes fruités', 'Gout : Fruité et léger', 'Toucher : Pâte onctueuse']","[<p style=""text-align: justify;"">Chignin rouge</p>]","['Saint-Félicien fermier', 'Reblochon Fermier AOP entier', 'Cantal AOP Entre-Deux fermier', 'Tomme de Tarentaise fermière']"
Tomme Catalane,Vache,Pressée non cuite,Provenance : Auvergne_Rhône-AlpesProducteur : Fromagerie ChabertLait : Lait cru de vache% Matière Grasse/Poids Total : 28 %,"['Œil : Couleur grise', 'Nez : arômes de nez et d’épices', 'Gout : Franc et marqué', 'Toucher : sec']","[<p>Un vin rouge de Savoie ou de Provence, ou une bière blonde, sèche et fruitée</p>]","['St-Nectaire Fermier AOP', 'Gouda Fermier Vieux 12-18 Mois', 'Cheddar Extra-Mature', 'Tomme du Jura']"
Tomme céronnée,Vache,Pressée non cuite,Provenance : Auvergne_Rhône-AlpesLait : Lait cru de vache,"['Oeil: croûte grise-marron, granuleuse et irrégulière', 'Nez : Odeur de cave et de terre humide', 'Goût : Goût de champignon', 'Toucher : Texture contrastée avec un coeur crayeux, acide et friable, et une sous-croûte souple, crémeuse et douces']",[<p>La Tomme crayeuse s’accompagne d’un Bergeron blanc.</p>],"['Tomme du Jura', 'Morbier AOP 100jours', 'Gouda Fermier Vieux 12-18 Mois', 'Tomme de Brebis des Pyrénées']"
Tomme crayeuse fermière,Vache,Pressée non cuite,Label : Appellation d'Origine Protégée AOP% Matière Grasse/Poids Total : 50 %Poids : 200 grammesLait : Lait cru de vache,"['Oeil : Couleur pâte jaune avec quelques yeux, croûte moisie naturelle de couleur grise', 'Nez : Léger et senteur de crème', 'Gout : saveur de chèvre avec une texture fondante et moelleuse', 'Toucher : Moelleuse, crémeuse']",[<p>Cette tomme se mariera parfaitement avec un vin rouge des coteaux de la Loire type Touraine AOC</p>],"['Tomme de Yenne', 'Gouda Fermier Vieux 12-18 Mois', 'Raclette de Savoie artisanale IGP', 'Tomme fermière au Foin']"
Tomme d’Anjou,Vache,Pressée non cuite,Provenance : Auvergne_Rhône-AlpesProducteur : Fromagerie DurouxLait : Lait pasteurisé de Vache% Matière Grasse/Poids Total : 29 %,"['Œil : Croûte avec un aspect rocailleux, faisant apparaitre du céron (poussière naturelle qui se développent car le fromage n’est pas brossé).', 'Goût : Fruité, onctueux et légèrement salé.']",[<p>La Tomme d’Auvergne Mitée se savoure avec le Pouilly et la Sancerre. L’équilibre entre ces vins blancs et ce fromage offre apparemment une expérience sensationnelle en bouche. Vous ne serez donc pas déçu de miser sur ces bouteilles lors de vos apéritifs accompagnés de Tomme de Rilhac.</p>],"['Tomme fermière au Foin', 'Tomme de Tarentaise fermière', 'Tome des Bauges AOP', 'Tomme de Yenne', 'St-Nectaire Fermier AOP']"
Tomme d’Auvergne Mitée,Vache,Pressée non cuite,Provenance : Centre-Val de Loire% Matière Grasse/Poids Total : 36 %Lait : Lait cru de vache,"['Oeil : Pâte jaune-orangée', 'Nez : boisé', 'Goût : Notes délicatement beurrées', 'Toucher : légèrement sec']","[<p>La Tomme de Berry s’accompagne d’un côtes de Provence, qu’il soit Rosé, rouge ou blanc.</p>]","['Tête de Moine entière', 'Camembert de Normandie AOP', 'Salers AOP', 'Tomme de Tarentaise fermière']"
Tomme de Berry,Vache,Pressée non cuite,Provenance : Auvergne_Rhône-AlpesLait : Lait pasteurisé de BrebisProducteur : Fromagerie Duroux,"['Oeil : Croûte fine, de couleur gris marroné', 'Nez : Odeur de pâturage', 'Goût : Douce et onctueuse en bouche', 'Toucher : Texture souple']",[<p>Cette tomme de brebis se sert avec un vin blanc sec tel qu’un Chardonnay.</p>],"['Mimolette', 'Saint Marcellin fermier IGP', 'Tomme du Jura', 'Raclette de Savoie artisanale IGP']"
Tomme de Brebis Affinée Tunnel,Brebis,Pressée non cuite,Provenance : Nouvelle AquitaineLait : Lait pasteurisé de Brebis% Matière Grasse/Poids Total : 33 %,"['Œil : Croûte marron clair à marron foncé selon son affinage.', 'Nez : Odeur de paille.', 'Goût : Pâte fondante, souple et onctueux en bouche. Typé et fruité', 'Toucher : Ferme']",[<p>Côtes d’Auvergne rouge</p>],"['Tête de Moine entière', 'Gouda Fermier Vieux 12-18 Mois', 'Tome des Bauges AOP', 'Bethmale']"
